{
  "format": "wiretruth.fixture/v1",
  "id": "ollama/truncation.reasoning-only",
  "scenario": "truncation.reasoning-only",
  "provider": "ollama",
  "tier": "recorded",
  "provenance": {
    "recorded_at": "2026-10-12T19:01:13Z",
    "requested_model": "qwen3.5:0.8b",
    "returned_model": "qwen3.5:0.8b",
    "recorder": "wiretruth 0.2.0.dev0",
    "source_commit": "c8ab367",
    "ci_run": "https://github.com/kartsan03/wiretruth/actions/runs/38294709109",
    "raw_sha256": "010b717abd2cab7780aae3061203d2a146033416763c3e3dd416b1de574704f3",
    "request": {
      "model": "qwen3.5:0.8b",
      "messages": [
        {
          "role": "user",
          "content": "Find the smallest positive whole number that leaves a remainder of 1 when divided by 2, 3, 4, 5 or 6 and is divisible by 7. Check your answer before replying."
        }
      ],
      "stream": false,
      "options": {
        "num_predict": 64
      },
      "think": true
    },
    "notes": ""
  },
  "derived_from": null,
  "exchanges": [
    {
      "match": {
        "method": "POST",
        "path": "/api/chat"
      },
      "response": {
        "status": 200,
        "headers": {
          "content-type": "application/json; charset=utf-8"
        },
        "body": {
          "json": {
            "model": "qwen3.5:0.8b",
            "created_at": "2026-10-12T19:01:17.433604074Z",
            "message": {
              "role": "assistant",
              "content": "",
              "thinking": "Let $n$ be the smallest positive whole number satisfying the given conditions.\nThe conditions are:\n1. Remainder when dividing by 2 is 1. So $n \\equiv 1 \\pmod 2$. This implies $n$ is odd.\n2. Remainder when dividing by"
            },
            "done": true,
            "done_reason": "length",
            "total_duration": 3728486452,
            "load_duration": 2447425,
            "prompt_eval_count": 54,
            "prompt_eval_cached_count": 0,
            "prompt_eval_duration": 554808000,
            "eval_count": 64,
            "eval_duration": 3162410000
          }
        },
        "end": "clean"
      }
    }
  ],
  "truth": {
    "finish": "length",
    "raw_finish": "length",
    "text": "",
    "tool_calls": [],
    "structured": null,
    "error": null,
    "stream_completed": null,
    "usage": {
      "input": 54,
      "cached_input": 0,
      "output": 64,
      "reasoning": null,
      "total": 118,
      "alternatives": {},
      "raw": {
        "prompt_eval_count": 54,
        "prompt_eval_cached_count": 0,
        "eval_count": 64
      }
    }
  }
}
