{
  "format": "wiretruth.fixture/v1",
  "id": "gemini/stream.missing-finish",
  "scenario": "stream.missing-finish",
  "provider": "gemini",
  "tier": "derived",
  "provenance": {
    "requested_model": "gemini-3.5-flash-lite",
    "returned_model": "gemini-3.5-flash-lite",
    "request": {
      "contents": [
        {
          "role": "user",
          "parts": [
            {
              "text": "Write a 200-word paragraph about how octopuses change colour to hide from predators."
            }
          ]
        }
      ],
      "generationConfig": {
        "maxOutputTokens": 16,
        "thinkingConfig": {
          "thinkingLevel": "MINIMAL"
        }
      }
    }
  },
  "derived_from": {
    "fixture": "gemini/truncation.text-stream",
    "transform": "strip_finish",
    "args": {},
    "rationale": "The stream ends cleanly without its finish signal.",
    "evidence_url": "https://github.com/pydantic/pydantic-ai/issues/6610"
  },
  "exchanges": [
    {
      "match": {
        "method": "POST",
        "path": "/v1beta/models/gemini-3.5-flash-lite:streamGenerateContent"
      },
      "response": {
        "status": 200,
        "headers": {
          "content-type": "text/event-stream"
        },
        "body": {
          "sse": [
            "data: {\"candidates\": [{\"content\": {\"parts\": [{\"text\": \"Octop\"}],\"role\": \"model\"},\"index\": 0}],\"usageMetadata\": {\"promptTokenCount\": 22,\"candidatesTokenCount\": 2,\"totalTokenCount\": 24,\"promptTokensDetails\": [{\"modality\": \"TEXT\",\"tokenCount\": 22}],\"serviceTier\": \"standard\"},\"modelVersion\": \"gemini-3.5-flash-lite\",\"responseId\": \"pgTOaonbKMuV_uMPvK7d4AE\"}\r\n\r\n",
            "data: {\"candidates\": [{\"content\": {\"parts\": [{\"text\": \"uses are the ultimate masters of disguise, utilizing a\"}],\"role\": \"model\"},\"index\": 0}],\"usageMetadata\": {\"promptTokenCount\": 22,\"candidatesTokenCount\": 12,\"totalTokenCount\": 34,\"promptTokensDetails\": [{\"modality\": \"TEXT\",\"tokenCount\": 22}],\"serviceTier\": \"standard\"},\"modelVersion\": \"gemini-3.5-flash-lite\",\"responseId\": \"pgTOaonbKMuV_uMPvK7d4AE\"}\r\n\r\n"
          ]
        },
        "end": "clean"
      }
    }
  ],
  "truth": {
    "finish": "none",
    "raw_finish": null,
    "text": "Octopuses are the ultimate masters of disguise, utilizing a",
    "tool_calls": [],
    "structured": null,
    "stream_completed": false,
    "usage": {
      "input": 22,
      "cached_input": null,
      "output": 12,
      "reasoning": null,
      "total": 34,
      "alternatives": {},
      "raw": {
        "promptTokenCount": 22,
        "candidatesTokenCount": 12,
        "totalTokenCount": 34,
        "promptTokensDetails": [
          {
            "modality": "TEXT",
            "tokenCount": 22
          }
        ],
        "serviceTier": "standard"
      }
    },
    "error": null
  }
}
