{
  "format": "wiretruth.fixture/v1",
  "id": "ollama-openai/truncation.text-stream",
  "scenario": "truncation.text-stream",
  "provider": "ollama-openai",
  "tier": "recorded",
  "provenance": {
    "recorded_at": "2026-10-12T19:01:21Z",
    "requested_model": "qwen3.5:0.8b",
    "returned_model": "qwen3.5:0.8b",
    "recorder": "wiretruth 0.2.0.dev0",
    "source_commit": "c8ab367",
    "ci_run": "https://github.com/kartsan03/wiretruth/actions/runs/38294739276",
    "raw_sha256": "f2d04f4da4a02f9d277d898cccee268a81e8f257072a93e0242f4370fcae79f4",
    "request": {
      "model": "qwen3.5:0.8b",
      "messages": [
        {
          "role": "user",
          "content": "Write a 200-word paragraph about how octopuses change colour to hide from predators."
        }
      ],
      "stream": true,
      "reasoning_effort": "none",
      "max_tokens": 16
    },
    "notes": ""
  },
  "derived_from": null,
  "exchanges": [
    {
      "match": {
        "method": "POST",
        "path": "/v1/chat/completions"
      },
      "response": {
        "status": 200,
        "headers": {
          "content-type": "text/event-stream"
        },
        "body": {
          "sse": [
            "data: {\"id\":\"chatcmpl-554\",\"object\":\"chat.completion.chunk\",\"created\":1791831681,\"model\":\"qwen3.5:0.8b\",\"system_fingerprint\":\"fp_ollama\",\"choices\":[{\"index\":0,\"delta\":{\"role\":\"assistant\",\"content\":\"Oct\"},\"finish_reason\":null}]}\n\n",
            "data: {\"id\":\"chatcmpl-554\",\"object\":\"chat.completion.chunk\",\"created\":1791831681,\"model\":\"qwen3.5:0.8b\",\"system_fingerprint\":\"fp_ollama\",\"choices\":[{\"index\":0,\"delta\":{\"content\":\"op\"},\"finish_reason\":null}]}\n\n",
            "data: {\"id\":\"chatcmpl-554\",\"object\":\"chat.completion.chunk\",\"created\":1791831681,\"model\":\"qwen3.5:0.8b\",\"system_fingerprint\":\"fp_ollama\",\"choices\":[{\"index\":0,\"delta\":{\"content\":\"uses\"},\"finish_reason\":null}]}\n\n",
            "data: {\"id\":\"chatcmpl-554\",\"object\":\"chat.completion.chunk\",\"created\":1791831681,\"model\":\"qwen3.5:0.8b\",\"system_fingerprint\":\"fp_ollama\",\"choices\":[{\"index\":0,\"delta\":{\"content\":\" rely\"},\"finish_reason\":null}]}\n\n",
            "data: {\"id\":\"chatcmpl-554\",\"object\":\"chat.completion.chunk\",\"created\":1791831681,\"model\":\"qwen3.5:0.8b\",\"system_fingerprint\":\"fp_ollama\",\"choices\":[{\"index\":0,\"delta\":{\"content\":\" on\"},\"finish_reason\":null}]}\n\n",
            "data: {\"id\":\"chatcmpl-554\",\"object\":\"chat.completion.chunk\",\"created\":1791831681,\"model\":\"qwen3.5:0.8b\",\"system_fingerprint\":\"fp_ollama\",\"choices\":[{\"index\":0,\"delta\":{\"content\":\" their\"},\"finish_reason\":null}]}\n\n",
            "data: {\"id\":\"chatcmpl-554\",\"object\":\"chat.completion.chunk\",\"created\":1791831681,\"model\":\"qwen3.5:0.8b\",\"system_fingerprint\":\"fp_ollama\",\"choices\":[{\"index\":0,\"delta\":{\"content\":\" unique\"},\"finish_reason\":null}]}\n\n",
            "data: {\"id\":\"chatcmpl-554\",\"object\":\"chat.completion.chunk\",\"created\":1791831681,\"model\":\"qwen3.5:0.8b\",\"system_fingerprint\":\"fp_ollama\",\"choices\":[{\"index\":0,\"delta\":{\"content\":\" physiology\"},\"finish_reason\":null}]}\n\n",
            "data: {\"id\":\"chatcmpl-554\",\"object\":\"chat.completion.chunk\",\"created\":1791831681,\"model\":\"qwen3.5:0.8b\",\"system_fingerprint\":\"fp_ollama\",\"choices\":[{\"index\":0,\"delta\":{\"content\":\" to\"},\"finish_reason\":null}]}\n\n",
            "data: {\"id\":\"chatcmpl-554\",\"object\":\"chat.completion.chunk\",\"created\":1791831681,\"model\":\"qwen3.5:0.8b\",\"system_fingerprint\":\"fp_ollama\",\"choices\":[{\"index\":0,\"delta\":{\"content\":\" camouflage\"},\"finish_reason\":null}]}\n\n",
            "data: {\"id\":\"chatcmpl-554\",\"object\":\"chat.completion.chunk\",\"created\":1791831681,\"model\":\"qwen3.5:0.8b\",\"system_fingerprint\":\"fp_ollama\",\"choices\":[{\"index\":0,\"delta\":{\"content\":\" against\"},\"finish_reason\":null}]}\n\n",
            "data: {\"id\":\"chatcmpl-554\",\"object\":\"chat.completion.chunk\",\"created\":1791831681,\"model\":\"qwen3.5:0.8b\",\"system_fingerprint\":\"fp_ollama\",\"choices\":[{\"index\":0,\"delta\":{\"content\":\" the\"},\"finish_reason\":null}]}\n\n",
            "data: {\"id\":\"chatcmpl-554\",\"object\":\"chat.completion.chunk\",\"created\":1791831681,\"model\":\"qwen3.5:0.8b\",\"system_fingerprint\":\"fp_ollama\",\"choices\":[{\"index\":0,\"delta\":{\"content\":\" vast\"},\"finish_reason\":null}]}\n\n",
            "data: {\"id\":\"chatcmpl-554\",\"object\":\"chat.completion.chunk\",\"created\":1791831681,\"model\":\"qwen3.5:0.8b\",\"system_fingerprint\":\"fp_ollama\",\"choices\":[{\"index\":0,\"delta\":{\"content\":\" array\"},\"finish_reason\":null}]}\n\n",
            "data: {\"id\":\"chatcmpl-554\",\"object\":\"chat.completion.chunk\",\"created\":1791831681,\"model\":\"qwen3.5:0.8b\",\"system_fingerprint\":\"fp_ollama\",\"choices\":[{\"index\":0,\"delta\":{\"content\":\" of\"},\"finish_reason\":null}]}\n\n",
            "data: {\"id\":\"chatcmpl-554\",\"object\":\"chat.completion.chunk\",\"created\":1791831681,\"model\":\"qwen3.5:0.8b\",\"system_fingerprint\":\"fp_ollama\",\"choices\":[{\"index\":0,\"delta\":{\"content\":\" natural\"},\"finish_reason\":null}]}\n\n",
            "data: {\"id\":\"chatcmpl-554\",\"object\":\"chat.completion.chunk\",\"created\":1791831681,\"model\":\"qwen3.5:0.8b\",\"system_fingerprint\":\"fp_ollama\",\"choices\":[{\"index\":0,\"delta\":{},\"finish_reason\":\"length\"}]}\n\n",
            "data: [DONE]\n\n"
          ]
        },
        "end": "clean"
      }
    }
  ],
  "truth": {
    "finish": "length",
    "raw_finish": "length",
    "text": "Octopuses rely on their unique physiology to camouflage against the vast array of natural",
    "tool_calls": [],
    "structured": null,
    "error": null,
    "stream_completed": true,
    "usage": {
      "input": null,
      "cached_input": null,
      "output": null,
      "reasoning": null,
      "total": null,
      "alternatives": {},
      "raw": null
    }
  }
}
