{
  "format": "wiretruth.fixture/v1",
  "id": "openai-chat/stream.missing-finish",
  "scenario": "stream.missing-finish",
  "provider": "openai-chat",
  "tier": "derived",
  "provenance": {
    "requested_model": "gpt-6-luna",
    "returned_model": "gpt-6-luna",
    "request": {
      "model": "gpt-6-luna",
      "messages": [
        {
          "role": "user",
          "content": "Describe a traditional Japanese breakfast in about 200 words, giving each dish its Japanese name (for example 味噌汁 or 焼き魚) and an English translation."
        }
      ],
      "stream": true,
      "stream_options": {
        "include_usage": true
      },
      "max_completion_tokens": 16,
      "reasoning_effort": "none"
    }
  },
  "derived_from": {
    "fixture": "openai-chat/truncation.text-stream-usage",
    "transform": "strip_finish",
    "args": {},
    "rationale": "The stream ends cleanly without its finish signal.",
    "evidence_url": "https://github.com/pydantic/pydantic-ai/issues/6610"
  },
  "exchanges": [
    {
      "match": {
        "method": "POST",
        "path": "/v1/chat/completions"
      },
      "response": {
        "status": 200,
        "headers": {
          "content-type": "text/event-stream; charset=utf-8"
        },
        "body": {
          "sse": [
            "data: {\"id\":\"chatcmpl-EXmWZAYmW8gL0ntPfYzZYrbv99Dcb\",\"object\":\"chat.completion.chunk\",\"created\":1791720059,\"model\":\"gpt-6-luna\",\"service_tier\":\"default\",\"system_fingerprint\":null,\"choices\":[{\"index\":0,\"delta\":{\"role\":\"assistant\",\"content\":\"\",\"refusal\":null},\"finish_reason\":null}],\"usage\":null,\"obfuscation\":\"\"}\n\n",
            "data: {\"id\":\"chatcmpl-EXmWZAYmW8gL0ntPfYzZYrbv99Dcb\",\"object\":\"chat.completion.chunk\",\"created\":1791720059,\"model\":\"gpt-6-luna\",\"service_tier\":\"default\",\"system_fingerprint\":null,\"choices\":[{\"index\":0,\"delta\":{\"content\":\"A\"},\"finish_reason\":null}],\"usage\":null,\"obfuscation\":\"b\"}\n\n",
            "data: {\"id\":\"chatcmpl-EXmWZAYmW8gL0ntPfYzZYrbv99Dcb\",\"object\":\"chat.completion.chunk\",\"created\":1791720059,\"model\":\"gpt-6-luna\",\"service_tier\":\"default\",\"system_fingerprint\":null,\"choices\":[{\"index\":0,\"delta\":{\"content\":\" traditional\"},\"finish_reason\":null}],\"usage\":null,\"obfuscation\":\"d52OTd\"}\n\n",
            "data: {\"id\":\"chatcmpl-EXmWZAYmW8gL0ntPfYzZYrbv99Dcb\",\"object\":\"chat.completion.chunk\",\"created\":1791720059,\"model\":\"gpt-6-luna\",\"service_tier\":\"default\",\"system_fingerprint\":null,\"choices\":[{\"index\":0,\"delta\":{\"content\":\" Japanese\"},\"finish_reason\":null}],\"usage\":null,\"obfuscation\":\"w1dZTLipP\"}\n\n",
            "data: {\"id\":\"chatcmpl-EXmWZAYmW8gL0ntPfYzZYrbv99Dcb\",\"object\":\"chat.completion.chunk\",\"created\":1791720059,\"model\":\"gpt-6-luna\",\"service_tier\":\"default\",\"system_fingerprint\":null,\"choices\":[{\"index\":0,\"delta\":{\"content\":\" breakfast\"},\"finish_reason\":null}],\"usage\":null,\"obfuscation\":\"MWjy8UlZ\"}\n\n",
            "data: {\"id\":\"chatcmpl-EXmWZAYmW8gL0ntPfYzZYrbv99Dcb\",\"object\":\"chat.completion.chunk\",\"created\":1791720059,\"model\":\"gpt-6-luna\",\"service_tier\":\"default\",\"system_fingerprint\":null,\"choices\":[{\"index\":0,\"delta\":{\"content\":\" is\"},\"finish_reason\":null}],\"usage\":null,\"obfuscation\":\"icVTZPFYRG5lFwL\"}\n\n",
            "data: {\"id\":\"chatcmpl-EXmWZAYmW8gL0ntPfYzZYrbv99Dcb\",\"object\":\"chat.completion.chunk\",\"created\":1791720059,\"model\":\"gpt-6-luna\",\"service_tier\":\"default\",\"system_fingerprint\":null,\"choices\":[{\"index\":0,\"delta\":{\"content\":\" built\"},\"finish_reason\":null}],\"usage\":null,\"obfuscation\":\"AYTZtVaq9EDe\"}\n\n",
            "data: {\"id\":\"chatcmpl-EXmWZAYmW8gL0ntPfYzZYrbv99Dcb\",\"object\":\"chat.completion.chunk\",\"created\":1791720059,\"model\":\"gpt-6-luna\",\"service_tier\":\"default\",\"system_fingerprint\":null,\"choices\":[{\"index\":0,\"delta\":{\"content\":\" around\"},\"finish_reason\":null}],\"usage\":null,\"obfuscation\":\"kMyBiZ4fH9u\"}\n\n",
            "data: {\"id\":\"chatcmpl-EXmWZAYmW8gL0ntPfYzZYrbv99Dcb\",\"object\":\"chat.completion.chunk\",\"created\":1791720059,\"model\":\"gpt-6-luna\",\"service_tier\":\"default\",\"system_fingerprint\":null,\"choices\":[{\"index\":0,\"delta\":{\"content\":\" rice\"},\"finish_reason\":null}],\"usage\":null,\"obfuscation\":\"ipQ7qmg7ME8qn\"}\n\n",
            "data: {\"id\":\"chatcmpl-EXmWZAYmW8gL0ntPfYzZYrbv99Dcb\",\"object\":\"chat.completion.chunk\",\"created\":1791720059,\"model\":\"gpt-6-luna\",\"service_tier\":\"default\",\"system_fingerprint\":null,\"choices\":[{\"index\":0,\"delta\":{\"content\":\",\"},\"finish_reason\":null}],\"usage\":null,\"obfuscation\":\"F\"}\n\n",
            "data: {\"id\":\"chatcmpl-EXmWZAYmW8gL0ntPfYzZYrbv99Dcb\",\"object\":\"chat.completion.chunk\",\"created\":1791720059,\"model\":\"gpt-6-luna\",\"service_tier\":\"default\",\"system_fingerprint\":null,\"choices\":[{\"index\":0,\"delta\":{\"content\":\" soup\"},\"finish_reason\":null}],\"usage\":null,\"obfuscation\":\"koHOHl6FSzjzv\"}\n\n",
            "data: {\"id\":\"chatcmpl-EXmWZAYmW8gL0ntPfYzZYrbv99Dcb\",\"object\":\"chat.completion.chunk\",\"created\":1791720059,\"model\":\"gpt-6-luna\",\"service_tier\":\"default\",\"system_fingerprint\":null,\"choices\":[{\"index\":0,\"delta\":{\"content\":\",\"},\"finish_reason\":null}],\"usage\":null,\"obfuscation\":\"c\"}\n\n",
            "data: {\"id\":\"chatcmpl-EXmWZAYmW8gL0ntPfYzZYrbv99Dcb\",\"object\":\"chat.completion.chunk\",\"created\":1791720059,\"model\":\"gpt-6-luna\",\"service_tier\":\"default\",\"system_fingerprint\":null,\"choices\":[{\"index\":0,\"delta\":{\"content\":\" and\"},\"finish_reason\":null}],\"usage\":null,\"obfuscation\":\"zgb5ipuHgdlxrv\"}\n\n",
            "data: {\"id\":\"chatcmpl-EXmWZAYmW8gL0ntPfYzZYrbv99Dcb\",\"object\":\"chat.completion.chunk\",\"created\":1791720059,\"model\":\"gpt-6-luna\",\"service_tier\":\"default\",\"system_fingerprint\":null,\"choices\":[{\"index\":0,\"delta\":{\"content\":\" a\"},\"finish_reason\":null}],\"usage\":null,\"obfuscation\":\"\"}\n\n"
          ]
        },
        "end": "clean"
      }
    }
  ],
  "truth": {
    "finish": "none",
    "raw_finish": null,
    "text": "A traditional Japanese breakfast is built around rice, soup, and a",
    "tool_calls": [],
    "structured": null,
    "error": null,
    "stream_completed": false,
    "usage": {
      "input": null,
      "cached_input": null,
      "output": null,
      "reasoning": null,
      "total": null,
      "alternatives": {},
      "raw": null
    }
  }
}
