{
  "format": "wiretruth.fixture/v1",
  "id": "ollama/tools.parallel-calls-stream",
  "scenario": "tools.parallel-calls-stream",
  "provider": "ollama",
  "tier": "recorded",
  "provenance": {
    "recorded_at": "2026-10-12T19:01:06Z",
    "requested_model": "qwen3.5:0.8b",
    "returned_model": "qwen3.5:0.8b",
    "recorder": "wiretruth 0.2.0.dev0",
    "source_commit": "c8ab367",
    "ci_run": "https://github.com/kartsan03/wiretruth/actions/runs/38294709109",
    "raw_sha256": "4dcb00f12379fbbd6910ced9d075a8abb4c8f58d8b7c80a9cf399ff1198b15ba",
    "request": {
      "model": "qwen3.5:0.8b",
      "messages": [
        {
          "role": "user",
          "content": "What's the weather like right now in São Paulo and in Zürich? Call the tool once for each city."
        }
      ],
      "stream": true,
      "tools": [
        {
          "type": "function",
          "function": {
            "name": "get_weather",
            "description": "Get the current weather for a city.",
            "parameters": {
              "type": "object",
              "properties": {
                "city": {
                  "type": "string"
                }
              },
              "required": [
                "city"
              ],
              "additionalProperties": false
            }
          }
        }
      ],
      "think": false
    },
    "notes": ""
  },
  "derived_from": null,
  "exchanges": [
    {
      "match": {
        "method": "POST",
        "path": "/api/chat"
      },
      "response": {
        "status": 200,
        "headers": {
          "content-type": "application/x-ndjson"
        },
        "body": {
          "ndjson": [
            "{\"model\":\"qwen3.5:0.8b\",\"created_at\":\"2026-10-12T19:01:10.221707224Z\",\"message\":{\"role\":\"assistant\",\"content\":\"\",\"tool_calls\":[{\"id\":\"call_8uaqob2r\",\"function\":{\"index\":0,\"name\":\"get_weather\",\"arguments\":{\"city\":\"São Paulo\"}}}]},\"done\":false}",
            "{\"model\":\"qwen3.5:0.8b\",\"created_at\":\"2026-10-12T19:01:11.273204818Z\",\"message\":{\"role\":\"assistant\",\"content\":\"\",\"tool_calls\":[{\"id\":\"call_nyjtbrz4\",\"function\":{\"index\":1,\"name\":\"get_weather\",\"arguments\":{\"city\":\"Zürich\"}}}]},\"done\":false}",
            "{\"model\":\"qwen3.5:0.8b\",\"created_at\":\"2026-10-12T19:01:11.38933263Z\",\"message\":{\"role\":\"assistant\",\"content\":\"\"},\"done\":true,\"done_reason\":\"stop\",\"total_duration\":5044967438,\"load_duration\":2849216,\"prompt_eval_count\":292,\"prompt_eval_cached_count\":0,\"prompt_eval_duration\":2830672000,\"eval_count\":55,\"eval_duration\":2201672000}"
          ]
        },
        "end": "clean"
      }
    }
  ],
  "truth": {
    "finish": "tool_calls",
    "raw_finish": "stop",
    "text": "",
    "tool_calls": [
      {
        "id": "call_8uaqob2r",
        "name": "get_weather",
        "arguments_raw": "{\"city\":\"São Paulo\"}",
        "arguments_parsed_ok": true,
        "arguments": {
          "city": "São Paulo"
        }
      },
      {
        "id": "call_nyjtbrz4",
        "name": "get_weather",
        "arguments_raw": "{\"city\":\"Zürich\"}",
        "arguments_parsed_ok": true,
        "arguments": {
          "city": "Zürich"
        }
      }
    ],
    "structured": null,
    "error": null,
    "stream_completed": true,
    "usage": {
      "input": 292,
      "cached_input": 0,
      "output": 55,
      "reasoning": null,
      "total": 347,
      "alternatives": {},
      "raw": {
        "prompt_eval_count": 292,
        "prompt_eval_cached_count": 0,
        "eval_count": 55
      }
    }
  }
}
