{
  "format": "wiretruth.fixture/v1",
  "id": "anthropic/truncation.text-stream",
  "scenario": "truncation.text-stream",
  "provider": "anthropic",
  "tier": "documented",
  "provenance": {
    "requested_model": "claude-sonnet-5-5",
    "returned_model": "claude-sonnet-5-5",
    "source_url": "https://platform.claude.com/docs/en/build-with-claude/streaming#streaming-request-with-thinking",
    "notes": "Documented shapes, not a recording. Message envelope and stop fields follow handling-stop-reasons; content blocks follow thinking/streaming and handle-tool-calls. Model changed to claude-sonnet-5-5; IDs and scenario text are filled in. Token counts are illustrative, filled in to include thinking within the requested output limit, not measured. ASSUMED composition: omitted thinking followed by a short text prefix at max_tokens; the docs do not show this exact small-budget response. Thinking is empty and the signature placeholder is copied literally from streaming#thinking-delta. SSE names, JSON shapes, field order and spaced text/thinking events follow streaming examples; the compact message_delta follows Streaming request with tool use. Fragment boundaries and counts are filled in. Signature placeholder is copied literally from the signature_delta example; empty thinking_delta follows the documented omitted display flow. The output_tokens_details.thinking_tokens breakdown follows thinking-steering.md (https://platform.claude.com/docs/en/build-with-claude/thinking-steering-and-cost#pricing); the thinking count of 8 is filled in, not measured. It appears only in the final message_delta usage.",
    "request": {
      "model": "claude-sonnet-5-5",
      "messages": [
        {
          "role": "user",
          "content": "Write a 200-word paragraph about how octopuses change colour to hide from predators."
        }
      ],
      "max_tokens": 16,
      "stream": true
    }
  },
  "derived_from": null,
  "exchanges": [
    {
      "match": {
        "method": "POST",
        "path": "/v1/messages"
      },
      "response": {
        "status": 200,
        "headers": {
          "content-type": "text/event-stream"
        },
        "body": {
          "sse": [
            "event: message_start\ndata: {\"type\": \"message_start\", \"message\": {\"id\": \"msg_01Aq9w938a90dw8q\", \"type\": \"message\", \"role\": \"assistant\", \"content\": [], \"model\": \"claude-sonnet-5-5\", \"stop_reason\": null, \"stop_sequence\": null, \"usage\": {\"input_tokens\": 25, \"output_tokens\": 1}}}\n\n",
            "event: content_block_start\ndata: {\"type\": \"content_block_start\", \"index\": 0, \"content_block\": {\"type\": \"thinking\", \"thinking\": \"\", \"signature\": \"\"}}\n\n",
            "event: ping\ndata: {\"type\": \"ping\"}\n\n",
            "event: content_block_delta\ndata: {\"type\": \"content_block_delta\", \"index\": 0, \"delta\": {\"type\": \"thinking_delta\", \"thinking\": \"\"}}\n\n",
            "event: content_block_delta\ndata: {\"type\": \"content_block_delta\", \"index\": 0, \"delta\": {\"type\": \"signature_delta\", \"signature\": \"EqQBCgIYAhIM1gbcDa9GJwZA2b3hGgxBdjrkzLoky3dl1pkiMOYds...\"}}\n\n",
            "event: content_block_stop\ndata: {\"type\": \"content_block_stop\", \"index\": 0}\n\n",
            "event: content_block_start\ndata: {\"type\": \"content_block_start\", \"index\": 1, \"content_block\": {\"type\": \"text\", \"text\": \"\"}}\n\n",
            "event: content_block_delta\ndata: {\"type\": \"content_block_delta\", \"index\": 1, \"delta\": {\"type\": \"text_delta\", \"text\": \"Octopuses \"}}\n\n",
            "event: content_block_delta\ndata: {\"type\": \"content_block_delta\", \"index\": 1, \"delta\": {\"type\": \"text_delta\", \"text\": \"change colour by\"}}\n\n",
            "event: content_block_stop\ndata: {\"type\": \"content_block_stop\", \"index\": 1}\n\n",
            "event: message_delta\ndata: {\"type\":\"message_delta\",\"delta\":{\"stop_reason\":\"max_tokens\",\"stop_sequence\":null},\"usage\":{\"output_tokens\":16,\"output_tokens_details\":{\"thinking_tokens\":8}}}\n\n",
            "event: message_stop\ndata: {\"type\": \"message_stop\"}\n\n"
          ]
        },
        "end": "clean"
      }
    }
  ],
  "truth": {
    "finish": "length",
    "raw_finish": "max_tokens",
    "text": "Octopuses change colour by",
    "tool_calls": [],
    "structured": null,
    "stream_completed": true,
    "usage": {
      "input": 25,
      "cached_input": null,
      "output": 16,
      "reasoning": 8,
      "total": 41,
      "alternatives": {},
      "raw": {
        "input_tokens": 25,
        "output_tokens": 16,
        "output_tokens_details": {
          "thinking_tokens": 8
        }
      }
    },
    "error": null
  }
}
