{
  "format": "wiretruth.fixture/v1",
  "id": "openai-chat/truncation.text",
  "scenario": "truncation.text",
  "provider": "openai-chat",
  "tier": "recorded",
  "provenance": {
    "recorded_at": "2026-10-07T16:46:15Z",
    "requested_model": "gpt-6-luna",
    "returned_model": "gpt-6-luna",
    "recorder": "wiretruth 0.1.0.dev0",
    "source_commit": "db258d0",
    "ci_run": "https://github.com/kartsan03/wiretruth/actions/runs/37654608733",
    "raw_sha256": "ab1df6877afd6c6434be4c2e3bf4ce240578614d78d6a31aea291962737dae34",
    "request": {
      "model": "gpt-6-luna",
      "messages": [
        {
          "role": "user",
          "content": "Write a 200-word paragraph about the history of Kyiv, in English."
        }
      ],
      "max_completion_tokens": 16,
      "reasoning_effort": "none"
    },
    "notes": ""
  },
  "derived_from": null,
  "exchanges": [
    {
      "match": {
        "method": "POST",
        "path": "/v1/chat/completions"
      },
      "response": {
        "status": 200,
        "headers": {
          "content-type": "application/json"
        },
        "body": {
          "json": {
            "id": "chatcmpl-EWP4SaSkFDlauld1wMMvsHUgDRu1s",
            "object": "chat.completion",
            "created": 1791391576,
            "model": "gpt-6-luna",
            "choices": [
              {
                "index": 0,
                "message": {
                  "role": "assistant",
                  "content": "Kyiv, the capital of Ukraine, has a history stretching back",
                  "refusal": null,
                  "annotations": []
                },
                "finish_reason": "length"
              }
            ],
            "usage": {
              "prompt_tokens": 21,
              "completion_tokens": 16,
              "total_tokens": 37,
              "prompt_tokens_details": {
                "cached_tokens": 0,
                "cache_write_tokens": 0,
                "audio_tokens": 0
              },
              "completion_tokens_details": {
                "reasoning_tokens": 0,
                "audio_tokens": 0,
                "accepted_prediction_tokens": 0,
                "rejected_prediction_tokens": 0
              }
            },
            "service_tier": "default",
            "system_fingerprint": null
          }
        },
        "end": "clean"
      }
    }
  ],
  "truth": {
    "finish": "length",
    "raw_finish": "length",
    "text": "Kyiv, the capital of Ukraine, has a history stretching back",
    "tool_calls": [],
    "structured": null,
    "error": null,
    "stream_completed": null,
    "usage": {
      "input": 21,
      "cached_input": 0,
      "output": 16,
      "reasoning": 0,
      "total": 37,
      "alternatives": {},
      "raw": {
        "prompt_tokens": 21,
        "completion_tokens": 16,
        "total_tokens": 37,
        "prompt_tokens_details": {
          "cached_tokens": 0,
          "cache_write_tokens": 0,
          "audio_tokens": 0
        },
        "completion_tokens_details": {
          "reasoning_tokens": 0,
          "audio_tokens": 0,
          "accepted_prediction_tokens": 0,
          "rejected_prediction_tokens": 0
        }
      }
    }
  }
}
